{
  "schema_version": "1.0-RC3",
  "protocol": {
    "name": "HACO Coordinate-Frame Stability Audit",
    "version": "1.0-RC3"
  },
  "run": {
    "run_id": "external-user-smoke-iris-l1",
    "timestamp_utc": "2026-08-27T15:16:24.356592+00:00",
    "engine_version": "1.0.0rc3",
    "seeds": [
      20260827,
      20260827
    ],
    "runtime_versions": {
      "python": "3.13.5",
      "numpy": "2.3.5",
      "scikit-learn": "1.8.0",
      "scipy": "1.17.0",
      "joblib": "1.5.3",
      "threadpoolctl": "3.6.0",
      "PyYAML": "6.0.3",
      "jsonschema": "4.26.0"
    }
  },
  "object_of_measurement": {
    "kind": "learning-procedure",
    "estimator": "builtin:knn-l1",
    "notes": "Fresh estimator fitted in identity and every transformed frame."
  },
  "data": {
    "datasets": [
      "sklearn:iris"
    ],
    "dataset_fingerprints": {
      "effective_X_y_sha256": "46981679fa66e4c5fa60e139c3a298ac417c464856c83f0735f8b4c52ac00117"
    },
    "split_strategy": "3-fold StratifiedKFold, shuffle=True, seed=20260827",
    "preprocessing": "center-global-rms"
  },
  "transformations": {
    "family": "proper orthogonal rotations",
    "count": 20,
    "strata_count": 3,
    "total_transform_evaluations": 60,
    "audit_status": "PASS",
    "max_orthogonality_error": 8.881784197001252e-16,
    "min_determinant": 0.9999999999999994
  },
  "measurement": {
    "max_pfr": 0.06,
    "mean_pfr": 0.016666666666666666,
    "median_pfr": 0.01,
    "nonzero_transformations": 30,
    "detection_rate": 0.5,
    "positive_folds": 3,
    "total_folds": 3,
    "endpoint": "prediction_flip_rate",
    "transformation_count": 60,
    "accuracy_identity_mean": 0.9466666666666667,
    "accuracy_rotated_min": 0.9,
    "accuracy_rotated_max": 1.0,
    "raw_artifact": "transform_results.json"
  },
  "policy": {
    "expected_relation": "sensitive",
    "max_pfr_tolerance": null,
    "min_pfr_expected": 1e-12,
    "min_detection_rate": 0.1,
    "min_positive_folds": 2,
    "notes": "User-declared policy."
  },
  "decision": "PASS",
  "limitations": [
    "RC3 audits refit behavior of supervised fit/predict procedures.",
    "A mathematically valid coordinate transform may be semantically invalid in some domains.",
    "Twenty rotations are empirical screening guidance, not a universal guarantee.",
    "Factory mode executes trusted local Python code and is not a security sandbox."
  ],
  "integrity": {
    "report_sha256": "c748f4ecdc451b45e1ae7e7d4f0f8a1373953d967d8b1ff5e74b88a16ea128c0",
    "artifact_sha256": {
      "transform_results.json": "d2f321f9ef1cfb9e0c4d2ef92ce5d48f78401d01d15503a15c147b46b30f4561"
    },
    "config_sha256": "f736cb47170a6f4e9b8f4b5b11b7d71b533198c4a55ef93bb7403599dfa36c41",
    "factory_sha256": null
  }
}